{"artifact_count":15,"artifacts":[{"byte_size":162,"media_type":"text/markdown","path":"LIMITATIONS.md","role":"limitations","sha256":"e54f0b36150497d279d31220adb9268cef09245a0307c9cd0ec872d2ff8473ad"},{"byte_size":3554,"media_type":"image/png","path":"artifacts/images/img-100dcf6b6c174824.source.png","role":"inspection_image","sha256":"9512e5c64b8cac718de62c8d1b663e0fc315ddaf81d8fee526eee26b228ce074"},{"byte_size":3227,"media_type":"image/png","path":"artifacts/images/img-319b6ad84ffd4ea8.source.png","role":"inspection_image","sha256":"7444709a82219ae3f2386517921ab4b3166e54b42649a18b0337ce9b8cc1a028"},{"byte_size":3227,"media_type":"image/png","path":"artifacts/images/img-e0c0a66f0c7d4393.source.png","role":"reference_image","sha256":"0f5292fac23f3ba4dcaeb32ea67766d136e60661c29fd47eb13e09699cd1276c"},{"byte_size":271,"media_type":"image/png","path":"artifacts/masks/analysis-6db5cbe853ca4f64.png","role":"anomaly_mask","sha256":"899d7b7d102ad338434e1993f907d493d08d44f26a4a3d5c95e8d740aad4dbe6"},{"byte_size":435,"media_type":"image/png","path":"artifacts/masks/analysis-75b1a9e5d6664675.png","role":"anomaly_mask","sha256":"20fefc97043321e1baf10b788488b4bdc8cdd83759049848d9ab67d6ca68db34"},{"byte_size":2099,"media_type":"application/json","path":"records/analyses/analysis-6db5cbe853ca4f64.json","role":"analysis_result","schema_id":"https://schemas.manufacturing-vision-studio.local/v1/analysis-result.schema.json","schema_version":"1.0.0","sha256":"f8cb0d406af7b05a954622afe1b3d6083855b0fe268fe64678addd81cd71ab13"},{"byte_size":2448,"media_type":"application/json","path":"records/analyses/analysis-75b1a9e5d6664675.json","role":"analysis_result","schema_id":"https://schemas.manufacturing-vision-studio.local/v1/analysis-result.schema.json","schema_version":"1.0.0","sha256":"54841744a0ded28566845344c9d9c9b43f5b1ece989e2b0ada0fb0bc8934b9db"},{"byte_size":896,"media_type":"application/json","path":"records/dispositions/disp-319e3fb2b5fb427a.json","role":"human_disposition","schema_id":"https://schemas.manufacturing-vision-studio.local/v1/human-disposition.schema.json","schema_version":"1.0.0","sha256":"fa8010f973586f62da2815443b170c742f81c4443f66a2b47e946357bfa74450"},{"byte_size":884,"media_type":"application/json","path":"records/dispositions/disp-beea6de374ca4f9f.json","role":"human_disposition","schema_id":"https://schemas.manufacturing-vision-studio.local/v1/human-disposition.schema.json","schema_version":"1.0.0","sha256":"d613023710e88a95dbf66f445e6a8053693e1a1be4d6c1ae1dbc844911818675"},{"byte_size":2015,"media_type":"application/json","path":"records/evaluation-report.json","role":"evaluation_report","schema_id":"https://schemas.manufacturing-vision-studio.local/v1/evaluation-report.schema.json","schema_version":"1.0.0","sha256":"38c79c5e571720610274076941f587625052c306ca0f52ec8b4efd3b4ab35a59"},{"byte_size":869,"media_type":"application/json","path":"records/images/img-100dcf6b6c174824.json","role":"inspection_image_metadata","schema_id":"https://schemas.manufacturing-vision-studio.local/v1/image-input-metadata.schema.json","schema_version":"1.0.0","sha256":"a30f1fd281332d49f1455a88fe986b404732ad567f17c8341c9a7f3a7333f2b2"},{"byte_size":870,"media_type":"application/json","path":"records/images/img-319b6ad84ffd4ea8.json","role":"inspection_image_metadata","schema_id":"https://schemas.manufacturing-vision-studio.local/v1/image-input-metadata.schema.json","schema_version":"1.0.0","sha256":"bdb56891cd6cbedfdb056fb3aedc0d55423deacd3d7fc20c74933f5c396002b2"},{"byte_size":871,"media_type":"application/json","path":"records/images/img-e0c0a66f0c7d4393.json","role":"reference_image_metadata","schema_id":"https://schemas.manufacturing-vision-studio.local/v1/image-input-metadata.schema.json","schema_version":"1.0.0","sha256":"9fe79819533af8b665149fb3b88a11b80902785afd3973c8287218b059e93ab6"},{"byte_size":926,"media_type":"application/json","path":"records/inspection-case.json","role":"inspection_case","schema_id":"https://schemas.manufacturing-vision-studio.local/v1/inspection-case.schema.json","schema_version":"1.0.0","sha256":"1d711b4fd3fa5131d5fd63435ffaf5bcac77d584df63ad17c5ef9dc5ee18262a"}],"bundle_id":"bundle-35606fde93bf07e3e9814fb0","case_id":"case-MVS-DEMO-001","case_revision":8,"created_at":"2026-07-31T11:40:23.345Z","exporter":{"exporter_id":"manufacturing-vision-studio","exporter_version":"1.0.0"},"hash_contract":{"algorithm":"sha256","artifact_order":"unicode_code_point_ascending_path","json_canonicalization":"mvs-canonical-json/v1"},"limitations":["Synthetic demo baseline only; not validated for production inspection."],"part_identity":{"cad_revision":"rev-A","part_id":"MVS-DEMO-001"},"payload_byte_size":22754,"payload_sha256":"35606fde93bf07e3e9814fb0ce1b0f87e19ec66e16345bde61502b4145061cd7","schema_version":"1.0.0"}